{
  "repository_id": "11111111-1111-4111-8111-111111111111",
  "generation_id": "44444444-4444-4444-8444-444444444444",
  "commit_sha": "0123456789abcdef0123456789abcdef01234567",
  "file_count": 12,
  "chunk_count": 40,
  "languages": [
    "python"
  ],
  "overview": "Example repository; fixture counts are not benchmarks."
}
